{
  "messageId": "a1b2c3d4-e5f6-7890-abcd-ef1234567811",
  "messageType": "sources.access.revoked",
  "occurredAt": "2026-08-01T12:00:00Z",
  "producer": "tasks-service",
  "payload": {
    "sourceId": "e5f6a7b8-c9d0-1234-ef01-345678901211",
    "provider": "vk",
    "sourceType": "community",
    "externalId": "123",
    "ownerId": -123,
    "accessScopeId": "a1a2a3a4-a5a6-a7a8-a9aa-abacadaeaf11",
    "createdByUserId": "b1b2b3b4-b5b6-b7b8-b9bb-bcbdbebfc011",
    "revision": 1
  }
}
